job_id,job_title,company_name,location,salary,rating
90836fd1bfed46f3,"newSenior Software Engineer, Data",Harnham,"Remote in San Francisco, CA","$160,000 - $180,000 a year",4.6
02833acb1a1096c6,newRemote Data Engineer,Pinnacle Group Workplace Solutions Provider,"Remote in El Segundo, CA",Estimated $107K – $135K a year,
e5f840bbbae06855,newData Center Engineer,Leaseweb,"San Francisco, CA",$250 a day,3.3
2e24c1f2acf00bc4,newRemote Data Engineer,Pinnacle Technical Resources,"Remote in El Segundo, CA 90245",Estimated $107K – $135K a year,
29f6166962a704a7,newData Engineer III - Sam's Club,Sam's Club,"Sunnyvale, CA 94086 (West Murphy area)",,3.5
6e7b8fc92d7f46a0,newSenior Analytics Engineer / Data Scientist,"Amick Brown, LLC","Santa Clara, CA",Estimated $123K – $156K a year,5.0
99206d9650cf6718,newData Conversion Engineer,Jade Global,"San Jose, CA 95110 (North San Jose area)",Estimated $104K – $132K a year,3.5
fc6574bc5d9315e7,newSenior Data Engineer,Enjoy Technology,"Remote in Palo Alto, CA 94304",,2.5
152193a7f0c9247d,newSenior Data Engineer - Opportunity for Working Remotely Los...,VMware,"Remote in Los Angeles, CA+2 locations",,4.1
1ab2736b4163fffc,newSenior Data Engineer,Harnham,"Burlingame, CA+4 locations","$170,000 - $210,000 a year",4.6
7e11732aa1b0fa02,newCrash Sensing Data Engineer,Tesla,"Fremont, CA",,3.4
264159534e962a25,"newSr. Data Engineer, Title Insights",Netflix,"Los Gatos, CA+2 locations",,3.9
22413d50122fe27c,newData Engineer,Abound,"Remote in San Francisco, CA",Estimated $132K – $167K a year,
e6a095c1cdf3ddaa,newQRT] Data Engineer,Luxoft,"Los Angeles, CA+2 locations",,4.4
0bf88d063537d707,newLead Data Engineer,RapidAI,"San Mateo, CA",Estimated $128K – $163K a year,
c9b3d6fb94d2ed50,newLead Data Engineer,RapidAI,"San Mateo, CA",Estimated $128K – $163K a year,
1ff5207e0b135e41,newData Engineer,Everlane,"Remote in San Francisco, CA 94110",Estimated $124K – $157K a year,3.7
c61a752f28e85276,"newSr. Data Engineer, UDW",Samsung Electronics,"Mountain View, CA 94043+1 location",,4.0
3d571aaf354d6ed1,newData Engineer - Telecommute,UnitedHealth Group,"Remote in San Jose, CA 95113+1 location",,3.6
0cd0a047502d65c1,new100% REMOTE Senior Data Engineer,CyberCoders,"Remote in Los Angeles, CA 90025+10 locations","$140,000 - $200,000 a year",3.6
fb63ca9b08f6ebfe,newSr. Data Engineer - Alteryx,Charles Schwab,California,"$110,000 - $201,600 a year",3.9
2d3ee28fa5348894,newPrincipal Data Engineer,Disney General Entertainment Content,"Los Angeles, CA",Estimated $136K – $173K a year,4.1
c23971b1c43a5672,newSenior Staff Engineer - Data and Threat - Opportunity for Wo...,VMware,"Remote in Palo Alto, CA",,4.1
6e7b8fc92d7f46a0,"newManager, Managed Security Services Information Security Engi...",KPMG,"San Diego, CA 92121 (Core-Columbia area)+7 locations",,3.9
956268f6db5afee8,newInsurance Cloud Data Warehouse Engineer- Senior Associate,PRICE WATERHOUSE COOPERS,"Remote in San Jose, CA 95110+20 locations",Estimated $90.5K – $115K a year,3.7
e6d2151c93908046,newSenior Data Engineer,SAIC,Remote in United States,"$75,001 - $100,000 a year",4.0
a1db69f7ead49ba6,newSenior QA Automation Engineer - Big Data,PubMatic,"Redwood City, CA 94063 (Downtown area)",Estimated $98.8K – $125K a year,3.9
bdae3badec59d7ae,"newStaff Data Engineer, Streaming and Big Data - Data Platform...",Visa,"Palo Alto, CA (Evergreen Park area)+24 locations",,3.9
84283c10455dcbd1,newGoogle Cloud Senior Data Engineer,Deloitte,"Los Angeles, CA 90013 (Downtown area)+8 locations",,4.0
fa6c2e36a38820b7,"newData Engineer , International Seller Services",Amazon.com Services LLC,"Santa Clara, CA 94085+9 locations",,3.5
b1328735361d16ec,newSenior Technical Staff Data Engineer - Streaming and Big Dat...,Visa,"Palo Alto, CA (Evergreen Park area)+1 location",,3.9
89615e43341b05bc,"newPrincipal Software Engineer - Big Data, Java, Hadoop",PubMatic,"Temporarily Remote in Redwood City, CA 94063",Estimated $149K – $188K a year,3.9
b076128580c34e3f,newStaff Engineer - Front End - Big Data,ServiceNow,"Santa Clara, CA 95054",,3.6
d57fec2f0ca2f87d,newStaff Software Engineer - Data Visualization - Big Data,ServiceNow,"San Diego, CA 92121 (University City area)+2 locations",,3.6
f8636d77a9359e14,newSr Staff/Principal Software Engineer (Big Data - Prisma Acce...,Palo Alto Networks,"Santa Clara, CA+3 locations",Estimated $143K – $181K a year,3.9
68083252d0e62cb3,"newSoftware Engineer - Big Data, Hadoop, Spark",PubMatic,"Temporarily Remote in Redwood City, CA 94063",Estimated $109K – $139K a year,3.9
3341f80942570ad0,newData Engineer #PP,Avispa Technology,"Remote in Sunnyvale, CA 94085",$80 - $95 an hour,4.8
94a66508a4558ee3,newData Engineer (Operations Team),Zitara,"San Francisco, CA 94103 (South of Market area)","From $115,000 a year",
5659346a52301dfe,newData Engineer,DispatchHealth,"Remote in San Francisco, CA","$110,000 - $140,000 a year",2.9
0341002cbe3ce447,newBig Data Engineer,Talent Tigers,"Mountain View, CA",$75 - $85 an hour,
46ff126c9e616e9e,newAnalytics Engineer - Growth Data,LaunchDarkly,"Remote in Oakland, CA",Estimated $108K – $136K a year,
7a5f380ec2c8c7b2,"newData Engineer (Entry, Intermediate, & Senior)",VideoAmp Careers Website,"Remote in Los Angeles, CA",Estimated $71.1K – $90.1K a year,
500e0a67df1f97ad,newData Engineer-Clinical,Helix,"San Mateo, CA",Estimated $115K – $146K a year,
468af6cd3bc7e5c8,newData Engineer,Change Healthcare,California,,3.0
92ca0171a8ad7f20,newSenior Data Engineer,Cadent,"Remote in San Jose, CA",Estimated $123K – $156K a year,3.3
551dfd1252553867,newSenior Data Engineer,Cadent,"Remote in San Jose, CA",,3.3
cb7cebbb6df08eda,newData Center Engineer (Greater Boston Area),Canonical - Jobs,"Remote in Sacramento, CA+3 locations",,
eb325a7bad45a920,"newSenior Software Engineer, Data",FATHOM,"Los Angeles, CA 90021 (Historic South-Central area)",,4.1
42b4be924d3cf5d3,"newData Protection Engineer - Sacramento, CA","Evergreen Technologies, LLC.","Remote in Antelope, CA+18 locations",,
2010050b7dad9664,newData Engineer,National University,"San Diego, CA 92106",,3.6
d218a29209959ef8,newCritical Data Center Facility Engineer IV,Equinix,"Torrance, CA 90501+2 locations",,3.7
04e14956e072ca17,newData Infrastructure Software Engineer,NextSense,"Hybrid remote in Mountain View, CA 94040",,
b43c3b4163a8c0ff,newData Platform Cloud Engineer II,Shutterfly,"Redwood City, CA 94065 (Westport area)",,3.7
772333972deafeb6,newData Engineer,Amgen,"Thousand Oaks, CA+2 locations",,4.0
0341002cbe3ce447,"newData Engineer II (Snowflake, SQL, AWS/Redshift)",Spiceworks,"Remote in Los Angeles, CA 90017+2 locations",,3.9
4c87377127459782,newSenior Data Engineer,Koniku Inc.,"San Rafael, CA 94901 (Canal area)","$100,000 - $180,000 a year",
1ef9f57a722986fc,newIntermediate Data Integration Engineer (Contract) (Remote),Conexus,"Remote in San Francisco, CA","$100,000 - $110,000 a year",3.8
cb5f50de21f9310a,newSenior Data Engineer,Cue Health,Remote in California+1 location,,2.5
da86028a1a66072e,newSoftware Engineer — Data Analytics Platform,Joyent,"Remote in San Francisco, CA 94111",,4.0
cc7cff09bd433118,"newLead Software Engineer, Data Engineering",ThousandEyes,"Remote in San Francisco, CA",,3.5
68c4902167d3bb06,newSoftware Engineer — Data Analytics Platform,Joyent,"Remote in San Francisco, CA 94111",Estimated $100K – $127K a year,4.0
a23851f767e30991,"newLead Software Engineer, Data Engineering",ThousandEyes,"Remote in San Francisco, CA",Estimated $132K – $167K a year,3.5
843028fe0d506799,newBuilding Engineer- - Critical Data Center,BGC Partners,"Sacramento, CA",Estimated $66.7K – $84.5K a year,3.6
e05252b95c3bf983,"newSenior Data Engineer, Content",Disney Streaming,"Santa Monica, CA",,
aa754d9d6e8739d2,"newData Center Facilities Engineering, Mechanical Engineer",Facebook App,"Fremont, CA+3 locations",,4.1
e42b2a0367a815ca,newSenior Data Engineer - REMOTE within United States,NextSense,"Hybrid remote in Mountain View, CA 94040",Estimated $115K – $145K a year,
447ebe4557504853,newSenior Data Engineer- Hybrid,The Goal Family of Companies,"San Diego, CA 92101",Estimated $122K – $154K a year,
4ec0b4827108eaa3,newProduct Data Solution Engineer,Intel,"Folsom, CA 95630",Estimated $95K – $120K a year,
600175f50bceef01,newSenior Data Engineer,Workday,"Pleasanton, CA+1 location",Estimated $120K – $152K a year,4.0
4c87377127459782,"newGround Aerospace Engineer - Space Data Center (0546U), Space...",University of California Berkeley,"Berkeley, CA 94720",,4.2
128495723eca7000,newData Infrastructure Engineer- Watson Orders,IBM,"San Jose, CA 95101 (North Valley area)",,3.9
cc7cff09bd433118,newAssociate Software Engineer- Big Data (REMOTE),Experian,"Remote in Costa Mesa, CA 92626",,3.6
7517ddb4e49f8284,"newSoftware Data Engineer, Staff",Qcom,"San Diego, CA 92154 (Otay Mesa area)",Estimated $133K – $168K a year,
360dbf8b57ae1b45,newData Analyst/Engineer (Design Research),eBay Inc.,"San Francisco, CA",,3.9
dccacab47950a962,"newExpert Data Engineer, Experian Consumer Services (remote)",Experian,"Remote in Costa Mesa, CA 92626+1 location",,3.6
a991a9785e4c2653,"newExpert Data Engineer, Experian Consumer Services (remote)",Experian,"Remote in Costa Mesa, CA 92626+1 location",,3.6
aa754d9d6e8739d2,newgRED IT Research Operations Data Analyst Engineer,ASK Consulting,"South San Francisco, CA",$74 - $78 an hour,4.2
49591979e0743a0d,newDCIM Data Center Engineer,BGC Partners,"Sacramento, CA",Estimated $52.1K – $65.9K a year,3.6
97e03a96613e956d,newPrincipal Data Engineer,Twentieth Century Fox,"Los Angeles, CA 90067 (Century City area)",Estimated $124K – $157K a year,4.1
1730662517a46782,newStaff Software Engineer - SASE Data Plane (DPDK),Lookout,"San Francisco, CA 94111 (Financial District/South Beach area)",Estimated $152K – $193K a year,4.0
8c8d2cdb27910de8,newPrincipal Engineer - data Scientist,WELLS FARGO BANK,"San Francisco, CA",,
ffc0b6fd87e3f756,"newSenior Data Scientist / Machine Learning Engineer, eCommerce",Autodesk,"Remote in San Francisco, CA",,4.1
a66f9d825ec01005,"newInnovation Team Data Engineer, DataSF (1043)",City and County of San Francisco,"San Francisco, CA 94102 (Downtown area)","$132,574 - $166,790 a year",4.0
67ddbca1d4be0590,newData Warehouse Engineer,Indeed,United States,"$107,000 - $156,000 a year",4.3
aaefa2a9b03135c9,newData Engineer,Indeed,United States,"$90,000 - $130,000 a year",4.3
241ac3b7027a55da,newData Engineer,Seniorly,"Remote in San Francisco, CA",Estimated $135K – $171K a year,1.7
94aae88488e4123e,newData Engineer I,ASK Consulting,"South San Francisco, CA",$75 - $80 an hour,4.2
e35c5353dfb90ec3,newData Engineer,Dr. Squatch,"Marina del Rey, CA",Estimated $97.8K – $124K a year,
af7041065cbb8be3,newEntry level Opportunity :: Data Engineer Entry level Opportu...,PCS Global Tech,"San Jose, CA","$70,000 - $80,000 a year",
ce801c28a6defece,newPython Data Engineer with GCP,Modernagile Technologies,"San Jose, CA",$60 - $65 an hour,
b78e1868f83dcab0,newSenior Data Engineer,Away Travel,"Remote in San Francisco, CA",,
2d7b2f7ddc5e73fe,newMachine Learning - Sr. Data Engineer,"IT Shoulders, Inc.","San Jose, CA",,
503d907075082425,newTactical Data Link (TDL) Lead Software Engineer,Technology Unlimited Group,"San Diego, CA",,
24a12bb8f64d9a28,newData Science Engineer,Mashvisor,Remote in California,,
8b3e449651dda2d3,newData Engineer,Lever Implementation Training Environment,"San Diego, CA",,
e71ac886cf13c261,newData Center NAND SSD Product Development Engineer (open to r...,Solidigm,"Remote in Folsom, CA+1 location",,
f570b3614bbace97,newData Center NAND SSD Software Engineer (open to remote),Solidigm,"Remote in Folsom, CA",,
4182536dbaf9495d,"newSenior Staff Software Engineer - Java/Scala, API design, Dat...",Lookout,"Remote in San Francisco, CA 94111",,4.0
b7f890d0678559ac,newComputer Engineer (Data Scientist),US Internal Revenue Service,"Fresno, CA","$111,521 - $168,506 a year",4.1
dc0f77303f33d231,newStaff Data Engineer - Visa Secure,Visa,"Foster City, CA+19 locations",,3.9
479e3ebad123aea2,newData Protection Engineer,OSI Digital,"Irvine, CA",,
d754925ccc9cd951,newSenior Software Engineer- Release Engineering - Data and AI...,Visa,"Hybrid remote in Foster City, CA",,3.9
5af68585b4b307fb,"newSenior Software Engineer - AWS Redshift Storage, Redshift Da...","Amazon Dev Center U.S., Inc.","East Palo Alto, CA+5 locations",,3.5
3964fd15f2452a39,newSenior Data Engineer – Analytics & Visualization,PlayStation Global,"San Francisco, CA+1 location",,
f34538165e7df9b1,newData Engineer 3,"TrueCar, Inc.","Remote in Santa Monica, CA",,3.5
7d574a1a2980a93b,"newSenior Software Engineer - AWS Redshift Storage, Redshift Da...","Amazon Dev Center U.S., Inc.","East Palo Alto, CA+5 locations",,3.5
5b6e8fc28d3184a8,newSenior Data Engineer – Analytics & Visualization,PlayStation Global,"San Francisco, CA+1 location",,
0136699116ad6578,newData Engineer 3,"TrueCar, Inc.","Remote in Santa Monica, CA",,3.5
87e37baff12492dc,newQA engineer - Data and CVML Platform,Blue River Technology,"Remote in Sunnyvale, CA",,4.0
b7f890d0678559ac,newSenior Data Operations Engineer,Aktana,"Remote in San Francisco, CA",,1.7
38d8e0a14340930a,newSenior Engineer -Observability Space (Data Dog InfluxDB Graf...,Braintrust,"San Francisco, CA 94133 (Russian Hill area)",$100 - $130 an hour,4.5
8f15efea8a14679d,newData Engineer - DX Marketing,Adobe,"San Jose, CA+1 location",,4.3
213a4be0b6d020a3,newSenior Data Engineer,Vareto,"Remote in Sunnyvale, CA",,
1e5403b4b02223bc,"newHardware Engineer, Global Data Center Connectivity",Meta,"Fremont, CA 94555 (Northgate area)+1 location",,4.1
3964fd15f2452a39,newSenior Data Engineer,Orange County's Credit Union,"Santa Ana, CA 92705",,4.0
1b0a72b724fbbc88,newData Engineer - Enterprise Data Team,Pure Storage,"Mountain View, CA",,3.6
f34538165e7df9b1,"newSoftware Development Engineer, Analytics and Data Management",Amazon.com Services LLC,"Santa Monica, CA 90404 (Mid-City area)+5 locations",,3.5
744f21be9b5f8a51,newSenior Data Engineer,Intuit,"Los Angeles, CA (Woodland Hills area)",,4.2
ab624763411a6dc1,newData Engineer,MilliporeSigma,"Carlsbad, CA 92011 (North Beach area)",,3.6
6aa3afcf32d3e644,newEDW Information Architect and Data Engineer [HYBRID],Southern California Edison,"Rosemead, CA 91771",,3.9
0252ae0c21e6555c,"newData Engineer, Go-To-Market Automation",Square,"Oakland, CA 94612 (Downtown area)",Estimated $119K – $151K a year,3.6
090cacbc9dacbba6,newSoftware Engineer - Master Data Management Technologies,Capital Group,"Remote in Irvine, CA 92618",,3.9
ab5fa159fdc5fb9e,newLead Software Engineer - Data Streaming (Remote),New Relic,"Remote in San Diego, CA 92173+2 locations",Estimated $139K – $177K a year,3.3
59dedd5efc81b0f4,newBI Data Engineer,mroads,"Mountain View, CA 94043",Estimated $110K – $139K a year,3.2
930831128292d3a3,newData Engineer (Remote),League Inc.,"Remote in Los Angeles, CA",Estimated $126K – $160K a year,
b72cabde970e60a2,"newREMOTE Data Engineer, Analytics",Paramount Pictures,"Remote in Los Angeles, CA 90038",,4.1
aaad080a586a5a85,newCustomer Support Reporting & Data Engineer,Plume,"Remote in Palo Alto, CA 94306",Estimated $95.1K – $120K a year,
dc178825beeb0f71,"newData Engineer, ML Platform",Change.org,"Remote in San Francisco, CA",Estimated $135K – $171K a year,3.8
72ce3c9a924856b4,newCloud Data Engineer,Google,"Palo Alto, CA",,4.3
74a25d133420deb3,newSoftware Engineer - Big Data (Multiple Locations),Evidation,"Remote in San Mateo, CA 94401",Estimated $118K – $150K a year,
d5d60fa843ceb780,newData Engineer,CEDARS-SINAI,"Los Angeles, CA",,4.1
dac20d777a454ad2,newSr. Data Engineer (Starlink),SpaceX,"Mountain View, CA",,3.6
8740218e6377b191,newData Engineer,League Inc,"Remote in Los Angeles, CA+1 location",Estimated $124K – $157K a year,
03f8a4dac7fc64a6,newLead Data Engineer,Stride Health,"San Francisco, CA",Estimated $145K – $183K a year,
9fb361d53327d6b5,newSr Data Engineer (Remote),Inspire,"Remote in Los Angeles, CA+1 location",Estimated $117K – $148K a year,3.4
479510c854899d96,newSenior Data Engineer,DISH,"Foster City, CA 94404 (Town Center area)","$100,625 a year",3.2
c568cb87a1ac7bb8,newData Engineer,Wing,"Remote in Palo Alto, CA+1 location",,
06af7989be91cbe6,newData Engineer,The Wonderful Company,"Hybrid remote in Los Angeles, CA+2 locations",Estimated $107K – $136K a year,
c420030068fde122,newData QA Engineer,Axos Bank,"San Diego, CA 92122 (University City area)",Estimated $74.1K – $93.9K a year,3.0
fa58a39ec292eb44,newGCP Data Engineer,Accenture,"San Francisco, CA+7 locations",,4.0
13e3b31a52caae1f,newData Engineer - Sr. Consultant - Data-as-a-Service,Visa,"Palo Alto, CA (Evergreen Park area)+1 location",,3.9
320dc99353fa8124,"newSenior Software Engineer - Customer Data Services, Cash App",Cash App,"Remote in Los Angeles, CA",Estimated $129K – $163K a year,
0e64bdc939cc9857,newBioinformatics data engineer,Predicine,"Hayward, CA 94545 (Glen Eden area)+1 location",Estimated $91.1K – $115K a year,1.5
1b5d31b2b504c8b4,"newSenior Data Security Engineer, SecOps",ACV Auctions,California,Estimated $130K – $165K a year,3.7
23a78e4b2c320fd9,newInformation Security Data Protection Engineer (remote),Solidigm,"Remote in San Jose, CA",Estimated $123K – $156K a year,
e0f9eaecdb166e33,newPrincipal Data Engineer,Morgan Stanley,"Menlo Park, CA",,3.8
8f1ed2fc911b5070,newSenior Software Engineer - Data Streaming,TigerGraph,"Remote in Redwood City, CA 94065",Estimated $133K – $169K a year,
05253bbdb46e6206,newPrincipal Data Platform Software Engineer,ServiceNow,"Santa Clara, CA 95054",,3.6
51fbdb06fc2e17f8,newSr Presales Engineer Data Protection Solutions,Dell Technologies,"Orange County, CA+1 location",,4.0
59aecfcc3f6a16f6,newPrincipal Data Architect / Software Engineer : 22-01422,Akraya Inc.,"Foster City, CA 94404",Estimated $141K – $178K a year,3.6
d8450e86c0c973b7,"newSenior Software Engineer - Customer Data Services, Cash App",Cash App,"Remote in Los Angeles, CA",Estimated $129K – $163K a year,
c568cb87a1ac7bb8,newPrincipal Data Architect / Software Engineer : 22-01422,Akraya Inc.,"Foster City, CA 94404",Estimated $141K – $178K a year,3.6
b617bc16f74be786,newSr Presales Engineer Data Protection Solutions,Dell Technologies,"Orange County, CA+1 location",,4.0
2bfef268008db778,Data Engineer,Intuitive,"Santa Clara, CA 95051+1 location",$80 - $98 an hour,4.0
fa58a39ec292eb44,newComputer Engineer (Data Systems),US Internal Revenue Service,"Fresno, CA","$131,178 - $176,300 a year",4.1
8264c6640c8591d7,Data Engineer,"Stefanini, Inc","San Francisco, CA+1 location","$150,000 - $170,000 a year",3.8
db0a49b16d4261a8,Senior Data Engineer,Akshaya,"Santa Clara, CA",$70 - $80 an hour,
69d86d855e088ba0,Data Engineer,EarnUp,"Hybrid remote in San Francisco, CA",Estimated $123K – $155K a year,
8301c221dc812051,Data Engineer,Swish Analytics,"Remote in San Francisco, CA 94133",Estimated $117K – $148K a year,
123dbee6d77cda36,newData Engineer,DCI Solutions,"El Segundo, CA 90245","$175,000 - $225,000 a year",
1b5d31b2b504c8b4,newSoftware Engineer - Data,Twitch,"San Francisco, CA",,4.4
f17bbfc61fe95f7f,Data Engineer,Carrot Fertility,"Remote in San Francisco, CA",Estimated $120K – $152K a year,
6c1da2915bb93dde,newSr. Big Data Engineer,Avratti Solutions Corp,"San Francisco, CA 94105 (Financial District/South Beach area)",Up to $80 an hour,
73e12209e3477b78,newData Reporting Engineer,"OSI Engineering, Inc","San Francisco Bay Area, CA",$50 - $60 an hour,
85fa8fddcb3f398f,Data Engineer,Chewie Labs,"Menlo Park, CA",Estimated $123K – $156K a year,
d8450e86c0c973b7,Data Engineer,Bosch Group,"Sunnyvale, CA 94085 (East Murphy area)",Estimated $92.4K – $117K a year,
c38ca63741b26160,newComputer Engineer (Data Systems),US Internal Revenue Service,"Fresno, CA","$131,178 - $176,300 a year",4.1
ded30302ccec8d38,newData Engineer,DCI Solutions,"El Segundo, CA 90245","$175,000 - $225,000 a year",
63b0c27ee7723ae7,Data Science Engineer,Adobe,"San Jose, CA",,4.3
10214c286592264b,Staff Data Engineer - Enterprise Data,realtor.com,"Santa Clara, CA",,3.3
cb636951e46abe53,"Big Data Engineer, Data Modeling",data.ai,"Remote in San Francisco, CA+1 location",Estimated $116K – $147K a year,4.2
c4c0a5809869fa50,Data Engineer,Genesis Capital LLC,"Sherman Oaks, CA",Estimated $116K – $147K a year,
b78937134b72b207,Data Engineer,Cloudbigdata Technologies,"Los Angeles, CA 90291 (Venice area)",Estimated $87.4K – $111K a year,
06ebd92b068bd124,Newsroom Data Engineer,alm,"Remote in San Francisco, CA 94103+1 location",Estimated $67.2K – $85.2K a year,2.8
83dd22ddbe6361ce,Senior Spacecraft Data Systems Engineer,BOEING,"El Segundo, CA 90245+1 location",,3.9
6bf5d67134a1ca38,eCommerce Data Engineer,PepsiCo,"San Francisco, CA (Financial District/South Beach area)+1 location",,3.8
487327190c3304b3,newData Engineer (Remote),West Coast University,"Remote in Irvine, CA 92617",Estimated $95.2K – $121K a year,3.7
73e12209e3477b78,Data Engineer,Robert Half,"Remote in Los Angeles, CA 90025","$120,000 - $135,000 a year",3.9
716e00b3af4756f8,"newSoftware Engineer, Data",Liftoff+Vungle,"San Francisco, CA",Estimated $101K – $128K a year,
5e6f833a07ad6ac6,Software Engineer (Data as a Service),Edmunds.com,"Remote in Santa Monica, CA 90404",Estimated $112K – $141K a year,3.4
336f6fa05ebb1cec,"Sr. Engineer, Data Protection",[RE]DESIGN,"Los Angeles, CA","$120,000 - $160,000 a year",
e1b792f1314df2d3,Data Engineer,The Wonderful Company,"Hybrid remote in Delano, CA+2 locations",Estimated $106K – $134K a year,
9a6dfdc18d7378b7,Data Engineer,KIPP SoCal Public Schools,"Remote in Los Angeles, CA 90063","$68,000 - $85,000 a year",2.8
5344dcab7e6a96bb,Senior Data Infrastructure Engineer,Databricks,"Remote in San Francisco, CA 94105",Estimated $128K – $162K a year,3.3
f9cefddd0b658f26,Vehicle Data Bus Engineer,Netradyne,"San Diego, CA",Estimated $96.5K – $122K a year,
a08d5977eef33c27,Associate Data Engineer,Ubisoft,"San Francisco, CA 94107 (Financial District/South Beach area)",Estimated $110K – $140K a year,3.8
63b0c27ee7723ae7,Data Engineer,Genesis Capital LLC,"Sherman Oaks, CA",Estimated $116K – $147K a year,
3a164597767df006,Engineer III - Data Integration,Inland Empire Health Plans,"Rancho Cucamonga, CA 91730","$90,992 - $116,017 a year",3.6
051a349c9ebc4bf2,newData Analyst & Visualization Engineer,Rivian Automotive,"Palo Alto, CA",Estimated $59.7K – $75.5K a year,2.7
3ca60ba15199eb0c,Lead Data Engineer,Quartzy,"Remote in Hayward, CA",Estimated $127K – $161K a year,
074be5f3196872f1,Senior Python Data Engineer (Remote till Pandemic),Embtel Inc,"Temporarily Remote in San Jose, CA",,
4c042277e0bbf3ac,"Senior Software Engineer, Games Data",Netflix,"Remote in Los Angeles, CA",,3.9
2057e8f5a6ebefca,"newSenior Software Engineer, Data Viz",Explo,"San Francisco, CA",Estimated $122K – $155K a year,
9a3df65e87918d04,"newSoftware Engineer, Data",System1,"Remote in Los Angeles, CA",Estimated $111K – $141K a year,
b67cc78c2ec59c41,"Senior Data Ops Engineer, Machine Learning Platform",ParkourSC,"Remote in San Jose, CA",Estimated $140K – $177K a year,
30ad589e44202cad,Software Engineer - Data Platform,Rubrik Job Board,"Palo Alto, CA",,
7d9017b8d513dc15,newInterface Engineer - IM Data Services (Copley Building),Rady Children's Hospital-San Diego,"San Diego, CA",,4.0
391e87d4fdf9fd3c,Backend - Data Engineer,PayPal,"San Jose, CA 95131 (North Valley area)",,3.9
06af7989be91cbe6,"Big Data Engineer, Data Modeling",data.ai,"Remote in San Francisco, CA+1 location",,4.2
6b4ac1dfdadcc342,"Staff, Data Engineer (L4) - Email Platform",Twilio,"Remote in Irvine, CA",,3.7
dcd4258e27e6844d,DevOps Software Engineer - Data,Twitch,"San Francisco, CA",,4.4
6aa650150b2e7079,"newData Engineer - Sunnyvale, CA OR San Jose, CA - Onsite",Tekrek Solutions,"Sunnyvale, CA+1 location",,
cb636951e46abe53,"newSystem Development Engineer , Data Management",Amazon.com Services LLC,"Hawthorne, CA 90250 (North Hawthorne area)",,3.5
11355f343ba8ef8c,Senior Data Engineer,Walmart,"Sunnyvale, CA 94086 (West Murphy area)+2 locations",,3.5
c4c0a5809869fa50,Data Center Operations Engineer Senior Associate - Equinix M...,Equinix,"Remote in Redwood City, CA 94065",,3.7
2c25bad63ad90b16,"Sr Machine Learning Engineer - NLP, data structures, $50M in...",Relentless Talent,"Remote in San Francisco, CA","$125,000 - $185,000 a year",
2133924944335ed8,newData Engineer - Sr. Consultant - Data-as-a-Service,Visa,"Palo Alto, CA (Evergreen Park area)+1 location",,3.9
d17ed36a6233e383,Data Science Engineer,Adobe,"San Jose, CA",,4.3
2f6127322378338e,Software Engineer (Data as a Service),Edmunds.com,"Remote in Santa Monica, CA 90404",,3.4
5e6f833a07ad6ac6,Data Engineer,"Amick Brown, LLC","Santa Clara, CA+1 location",,5.0
7d48b4188b2330f3,Software Engineer (Data as a Service),Edmunds.com,"Remote in Santa Monica, CA 90404",Estimated $112K – $141K a year,3.4
83cff6a258781abc,Data Engineer,"Amick Brown, LLC","Santa Clara, CA+1 location",Estimated $109K – $138K a year,5.0
aaf7c9276d922d88,newData Engineer,WelBeHealth,"Los Angeles, CA",,5.0
cf03794751909d30,Data Engineer - E-Commerce Analytics,E. & J. Gallo Winery,"Modesto, CA","$72,235 - $127,700 a year",4.1
2be3fdf664ddaebf,Data and Integration Engineer (Workato),Triune Infomatics Inc,"Emeryville, CA",Estimated $112K – $142K a year,
11355f343ba8ef8c,Data Visualization Engineer - Tableau,MotorTrend Group,"El Segundo, CA",Estimated $93.3K – $118K a year,4.3
670eb8da53bc7607,Senior Software Engineer - Data Platform (Open to U.S. Remot...,Exabeam,"Remote in Foster City, CA",Estimated $143K – $180K a year,3.0
c4c0a5809869fa50,"Software Engineer, Cloud Data Collection",DFLabs,"Redwood City, CA",Estimated $105K – $133K a year,
112a3be5f2c7d0bf,Ground Data System Operations Engineer,Red Canyon Engineering & Software,"Pasadena, CA",Estimated $104K – $132K a year,
0ccef573581f7474,newSoftware Engineer - Data Engineering,Muon Space Inc,"Mountain View, CA",Estimated $125K – $158K a year,
