job_id,job_title,company_name,location,salary,rating
7dd200e5533c9b88,Principal Data Engineer,Shutterfly,"Remote in Redwood City, CA 94065","$135,400 a year",3.7
f9b436399b6fde96,Data Center Systems Engineer,Meta,"Fremont, CA 94555 (Northgate area)",,4.1
15ec857974672fac,Data Quality Engineer,Whip Media,"Remote in Los Angeles, CA",,
9365faef9b77d7eb,Senior Data Quality Engineer,Komodo Health,"Remote in San Francisco, CA 94107",,3.3
52c759523645acf7,Senior Data Engineer,Turo,"San Francisco, CA (Outer Mission area)",,3.9
8dc7cbaede05ffa4,Data Platform Engineer,Adobe,"San Jose, CA",,4.3
58a7e3268ae501d0,Machine Learning and Data Scientist Engineer,Linux Foundation,"San Francisco, CA",,
45fc929be4e10899,Sr. Manufacturing Engineer- Data Analytics,Medtronic,"Northridge, CA 91325",,3.9
980446a4a54d4a4b,"Senior Data Engineer, Big Data and Deep Learning",Stessa,Remote in California,,
594a5eb26f3b36a0,Backend Software Engineer- Data Platform,FLYR Labs,"Los Angeles, CA+2 locations",,
95c2531be01f9c5a,Data Center Systems Engineer,Meta,"Fremont, CA 94555 (Northgate area)",Estimated $124K – $157K a year,4.1
0feeb3eaa9d63cfd,Data Quality Engineer,Whip Media,"Remote in Los Angeles, CA",Estimated $112K – $141K a year,
ea9dfe38d635ee6b,Senior Data Quality Engineer,Komodo Health,"Remote in San Francisco, CA 94107",Estimated $139K – $176K a year,3.3
9ec155599bf11702,Senior Data Engineer,Turo,"San Francisco, CA (Outer Mission area)",Estimated $152K – $192K a year,3.9
9002c798dd9a8bad,Data Platform Engineer,Adobe,"San Jose, CA",,4.3
0831d53ee92e55a3,Machine Learning and Data Scientist Engineer,Linux Foundation,"San Francisco, CA",Estimated $144K – $182K a year,
7dd200e5533c9b88,Sr. Manufacturing Engineer- Data Analytics,Medtronic,"Northridge, CA 91325",,3.9
37c88ff3e2170dde,"Senior Data Engineer, Big Data and Deep Learning",Stessa,Remote in California,Estimated $141K – $178K a year,
9365faef9b77d7eb,Backend Software Engineer- Data Platform,FLYR Labs,"Los Angeles, CA+2 locations",Estimated $110K – $139K a year,
a9a7b9021d6b82ed,"Senior Software Engineer, Data Infrastructure (Enterprise Cr...",Ripple,"San Francisco, CA 94105 (Financial District/South Beach area)",Estimated $145K – $184K a year,3.5
52c759523645acf7,Data Engineer,Nauto,"Palo Alto, CA",Estimated $81.5K – $103K a year,
8dc7cbaede05ffa4,Senior Data Engineer (JRD DS),Johnson & Johnson Family of Companies,"San Francisco, CA",Estimated $156K – $197K a year,
58a7e3268ae501d0,"Data Engineer, Integrations - SaaS",Siemens,"Cypress, CA+1 location",,4.0
45fc929be4e10899,Cloud Engineer 2 (BI and Data Platforms),Providence,"Irvine, CA 92604",,3.9
980446a4a54d4a4b,Senior Backend Software Engineer - Data Platform,FLYR Labs,"San Francisco, CA+1 location",Estimated $145K – $183K a year,
34511b915836da00,Sr. Data Engineer,"Rodan and Fields, LLC","San Ramon, CA 94583+2 locations",Estimated $126K – $160K a year,
3bfbcbf6cb389171,DevOps Software Engineer - Data,"Twitch Interactive, Inc.","San Francisco, CA",,3.5
26fbcc36c4ec2b81,"Senior DevOps Engineer, Data Platform (Enterprise Crypto)",Ripple,"San Francisco, CA 94105 (Financial District/South Beach area)",Estimated $154K – $195K a year,3.5
5dd781a6c6304b85,Data Scientist/RCA Engineer,General Atomics and Affiliated Companies,"Poway, CA",,3.7
c20a44d1e7697718,Data Engineer- Digital Marketing,Albertsons Companies,"Pleasanton, CA 94588",,
f6f640aebdf55d58,AWS Cloud Data Engineer,Medtronic,"Northridge, CA 91325+2 locations",,3.9
ca70e9d4767620da,Staff Data Scientist /ML Engineer - Opportunity for Working...,VMware,"Remote in Palo Alto, CA+2 locations",,4.1
90c758f177838d8c,Sr Data Engineer,Albertsons Companies,"Pleasanton, CA 94588",,
a639d9f585b1e857,"Lead Engineer, Data Platform",Sephora,"Remote in San Francisco, CA 94103",,3.8
448a582a35392755,Senior Site Reliability Engineer – Data Platform & Governanc...,Chegg,"Remote in Santa Clara, CA 95054",Estimated $137K – $174K a year,3.9
78d9e499bd43fd5b,Power System Software and Data Engineer,Electric Power Research Institute,"Palo Alto, CA 94304",Estimated $84.1K – $106K a year,3.8
650009befae33b6c,"Senior Engineer, Data Platform",Sephora,"Remote in San Francisco, CA 94103",,3.8
a99fd458e739e5a9,Senior Data Analytics Engineer,New Relic,"San Francisco, CA 94105 (Financial District/South Beach area)",Estimated $123K – $156K a year,3.3
5c8f7d080df85825,DevOps Data Engineer,Albertsons Companies,"Pleasanton, CA 94588",,
1aba500b6bf1d95c,"Principal Engineer, Data",Sephora,"Remote in San Francisco, CA 94103",,3.8
208043745e7bc570,"Senior Engineer, Data Platform",Sephora,"Remote in San Francisco, CA 94103",,3.8
f6f640aebdf55d58,Senior Data Analytics Engineer,New Relic,"San Francisco, CA 94105 (Financial District/South Beach area)",Estimated $123K – $156K a year,3.3
ca70e9d4767620da,DevOps Data Engineer,Albertsons Companies,"Pleasanton, CA 94588",,
90c758f177838d8c,"Principal Engineer, Data",Sephora,"Remote in San Francisco, CA 94103",,3.8
a639d9f585b1e857,Sr Data Engineer – Sales and Marketing Solutions,AlignTech,"San Jose, CA 95134 (North San Jose area)",Estimated $103K – $131K a year,
932445bfd27af71d,newASSOCIATE GOVERNMENTAL PROGRAM ANALYST,California Public Utilities Commission,"Napa County, CA","$5,383 - $6,942 a month",3.9
cf1f7bcfbbd8c96d,newSTAFF SERVICES ANALYST (GENERAL),California Public Utilities Commission,"Madera County, CA","$3,448 - $5,604 a month",3.9
12a12bd65e329b5e,newRESEARCH DATA ANALYST II,California Public Utilities Commission,"Orange County, CA","$5,652 - $7,290 a month",3.9
e1589741a3b53192,newASSOCIATE PERSONNEL ANALYST,California Public Utilities Commission,"Sacramento County, CA","$5,383 - $6,739 a month",3.9
aa57dcdf2a5c84aa,newRESEARCH DATA ANALYST I,California Public Utilities Commission,"Yolo County, CA","$3,800 - $6,062 a month",3.9
e5567cde7d6c2d9a,newEDI Analyst,Belcan,"Remote in Irvine, CA",,3.6
958d8d6dac2378c9,"newTitle IX & Discrimination, Harassment, and Retaliation Preve...",California State University,Remote in California,"$3,288 - $6,347 a month",4.3
0840e22e18e28034,"newData Analyst, Routing - Python experience [REMOTE] | US Only...",Braintrust,"Remote in San Francisco, CA 94133 94133",$40 - $60 an hour,4.5
c9d6266fea406fca,newProfessional Loan Portfolio Data Analyst,First Republic Bank,"San Francisco, CA 94111 94111 (Financial District/South Beach area)+1 location",,3.9
0463911f1478ff8d,newBusiness Intelligence Analyst 2,Community Health System - CA,"Fresno, CA 93650 93650+1 location",,3.8
fc42b92f1231bc9c,newData Analyst,Kelly,"Remote in Sunnyvale, CA 94089 94089+2 locations",$30 - $45 an hour,3.8
45896771d725150a,newMarketing Data Analyst,FocusKPI Inc.,"Remote in Mountain View, CA",,
61baf41ec8bc389c,newData Integration Analyst-Replatform (PH),The Walt Disney Company (Corporate),"Burbank, CA+2 locations",,4.1
563ef88a5af852d2,newData Analyst,WEBTOON Entertainment,"Los Angeles, CA 90036 90036",,
1b39755f8abdda9b,newData Analyst,Intermedia Advertising,"Woodland Hills, CA 91367 91367",,4.2
dda588702d7fc07e,newData Analyst,Intermedia Advertising,"Woodland Hills, CA 91367 91367",Estimated $62.7K – $79.3K a year,4.2
cf1f7bcfbbd8c96d,newData Analyst I,EasyPay Finance,"Vista, CA",Estimated $67.8K – $85.8K a year,
94d14f069e8813b6,newSenior Data Analyst,FocusKPI Inc.,"Los Angeles, CA",Estimated $105K – $132K a year,
0552d6439ac3e0a2,"newTitle IX & Discrimination, Harassment, and Retaliation Preve...",Humboldt State University,"Remote in Arcata, CA 95521 95521","$3,288 - $6,347 a month",4.2
cddabdac96cc7e9f,newBI Reporting Analyst,FocusKPI Inc.,"San Francisco, CA",Estimated $91.5K – $116K a year,
041293765576ae5d,newFinancial Analyst,Seek Thermal,"Goleta, CA 93117 93117",,3.3
b5f4a96c80151080,newData Insights Analyst,Creative Artists Agency (CAA),"Los Angeles, CA",Estimated $58.3K – $73.9K a year,
add8f04f4561c686,"newData Analyst, US Finance",Abbvie,"Irvine, CA+1 location",,4.0
7fa2e7e51704fd86,newAnalyst II - Data Quality & Reporting,Inland Empire Health Plans,"Rancho Cucamonga, CA 91730 91730",Estimated $66.3K – $83.9K a year,3.6
47460e5415d2cfd6,newSenior Human Resources Analyst,"City of Elk Grove, CA",California,"$86,571 - $116,027 a year",
9a8696ef936cea21,newBusiness Analyst,DT Professional Services,"Remote in Los Angeles, CA 90001 90001+1 location",Estimated $75.2K – $95.2K a year,
318a50f8026aa4f9,newManagement Analyst,City of Chico,"Chico, CA",Estimated $55.4K – $70.2K a year,4.3
6ece27fa8cd8e0b7,newData Analyst - Sales Enablement,Live Nation,"Los Angeles, CA",,4.1
6462770a9609fab3,newJunior Data Analyst – Media Buyer,VS Media,"Westlake Village, CA 91361 91361",$20 - $24 an hour,2.9
cfe5e023242f5462,newJunior Data Analyst – Advertising Operations,VS Media,"Westlake Village, CA 91361 91361",$18 - $20 an hour,2.9
dda588702d7fc07e,newSenior Human Resources Analyst,"City of Elk Grove, CA",California,"$86,571 - $116,027 a year",
94d14f069e8813b6,newSenior GIS Product Designer/Data Analyst (1053),City and County of San Francisco,"San Francisco, CA 94103 94103 (Mission area)","$111,722 - $140,582 a year",4.0
00609f0c5c4aae2c,newData Insights Analyst,Creative Artists Agency (CAA),"Los Angeles, CA",,
89de70a420dd89d7,newAnalyst II - Data Quality & Reporting,Inland Empire Health Plans,"Rancho Cucamonga, CA 91730 91730",,3.6
5e30d37ed877337f,newData Analyst,CyberCoders,"West Hollywood, CA 90038 90038","$75,000 - $90,000 a year",3.6
fce7b109efae188e,newRemote Senior IT Business Analyst,Banner Health,"Remote in Diamond Bar, CA+2 locations",,3.6
66681cb852bb013e,newData Analytics Senior Specialist [HYBRID],Southern California Edison,"Irwindale, CA 91702 91702+1 location",,3.9
4570a90eb9e4f6c1,newData Analyst - Sales Enablement,Live Nation,"Los Angeles, CA",,4.1
200d1eaa549ef5e2,newBI Report Developer & Analyst I,Word & Brown Companies,"Orange, CA",,3.1
ff1eb6fd2a85116b,newMarketing Analyst (JO-2202-150584),Ledgent Technology,"Sacramento, CA 95815 95815 (Point West area)+1 location",,3.7
9a8696ef936cea21,"newSr. Business Analyst, Content & Programming",Pluto TV,"Los Angeles, CA 90069 90069",,
2974d81b9e247d1e,newPrincipal Hearing Officer & Data Analytics Manager - Landsid...,City and County of San Francisco,"San Francisco, CA 94128 94128","$133,224 - $162,032 a year",4.0
6ece27fa8cd8e0b7,newAcademic Office Coordinator (Administrative Analyst/Speciali...,San Francisco State University,"San Francisco, CA 94132 94132 (Lakeshore area)","$50,400 - $55,200 a year",4.2
84d279729e7c7c8b,"newSenior Analyst, Data Governance",Chipotle,"Newport Beach, CA",,
be2ab56419c0cfaf,newSenior Actuarial Analyst,Delta Dental Ins.,"Oakland, CA",,3.5
d4e02d117384331b,newCuracao - Data Analyst,Adir International LLC,"Los Angeles, CA 90015 90015",Estimated $62.7K – $79.5K a year,3.2
70c2de9f883314c0,newCommuter & Parking Data Analyst,UCLA,"Los Angeles, CA+4 locations",,4.2
e9cdc30528ed333a,newData Analyst I,"4Liberty, Inc.","Hybrid remote in San Diego, CA 92111 92111",Estimated $52.9K – $66.9K a year,4.7
a8d82c8d7ac650e7,newSr Data Analyst,Disney Media & Entertainment Distribution,"Santa Monica, CA+1 location",,
5331138184a87b90,newData Analyst- US Programs,Internews,"Remote in Arcata, CA",Estimated $48.6K – $61.6K a year,
e4d6698471cf1db9,newData Mapping Analyst - Healthcare Imaging,Change Healthcare,California+1 location,,3.0
5b2644954b5ef9b9,newData Analyst,APM Music,"Hollywood, CA",Estimated $74.7K – $94.7K a year,3.0
e95c8ad852b13408,newData Science Analyst,Unison,"San Francisco, CA (Outer Sunset area)",Estimated $97.4K – $123K a year,
d83921aea8d0adf8,newEntry Level Business Analyst,ALCglobalSoftware,"Los Angeles, CA 90067 90067 (Century City area)","$60,000 - $80,000 a year",
24f7aa7b6e2a345f,newHealthcare Data Analyst,Wonderful Center for Health Innovation,"Los Angeles, CA",,
0fe6da1699c019b6,newBioengineer & Health Analyst,Invoy,"Irvine, CA",Estimated $60.5K – $76.7K a year,3.6
658db8ccfdd3d2f3,newSr. Data Analyst,Enquero Inc,"Remote in Milpitas, CA 95035 95035",Estimated $78.4K – $99.2K a year,
c2f12f6609a109e6,newBusiness Analyst,Maersk,"Remote in Los Angeles, CA",,4.1
1551f353317d2dc4,newApplication Analyst - CVMC Data Processing,Prime Healthcare,"Chino, CA 91710 91710+1 location",,3.4
9dd8370ea370d859,newEntry Level-Business Analyst,Flexon Technologies Inc,"Pleasanton, CA 94588 94588","From $65,000 a year",
f5c2a62ab8f78c29,newBusiness Analyst,Maersk,"Remote in Los Angeles, CA",,4.1
ec13c965576ee576,newMarketing Data Analyst,Pacific Life,"Remote in Aliso Viejo, CA 92656 92656",Estimated $54.8K – $69.4K a year,3.8
e606cc081d364e7c,newData Analyst (Operations),Guardant Health,"Redwood City, CA 94063 94063 (Harbor area)+1 location",Estimated $86.2K – $109K a year,2.8
31774bec262c4aa4,newBusiness Analyst,You Exec LLC,"Temporarily Remote in Los Angeles, CA 90019 90019","$70,000 - $85,000 a year",
66ebc5c27044b66a,newHealthcare Data Analyst III,Inland Empire Health Plans,"Rancho Cucamonga, CA 91730 91730+2 locations","$103,709 - $132,226 a year",3.6
7dd3d5d32f772e59,newCommercial Bank - Data Product Analyst - Associate,"JPMorgan Chase Bank, N.A.","Palo Alto, CA",,3.9
eb5d0fb8d338e56c,newData Analyst,Thermo Fisher Scientific,"Pleasanton, CA 94566 94566+3 locations",,3.5
37f37138a7ff1526,newHealthcare Data Analyst I - Pharmacy,Inland Empire Health Plans,"Rancho Cucamonga, CA 91730 91730+2 locations","$79,810 - $101,774 a year",3.6
45db2adf82b0d5a6,newResearch Data Analyst 1,Stanford University,"Remote in Stanford, CA+2 locations",,4.2
0eb4abfeaf4815fe,newQA Analyst,Pro Integrate Consulting,"Sunnyvale, CA 94086 94086 (West Murphy area)",$50 - $80 an hour,
12552d4e5c6ccbbf,"newSr Analyst, Data Scientist",Gilead Sciences,"Foster City, CA",,3.6
d22815b0e054a956,newData Analyst (Atwater),Golden Valley Health Centers,"Atwater, CA 95301 95301",$30.65 an hour,3.3
2da45eee601f5701,newBusiness Analyst,Abbott Laboratories,"Temecula, CA",Estimated $63.5K – $80.5K a year,4.0
658db8ccfdd3d2f3,newOperational Business Analyst,DHL,"Ontario, CA 91710 91710",,3.7
f0e6ce86620b4923,newBusiness Analyst I,Centene Corporation,"Hybrid remote in Rancho Cordova, CA+1 location",,3.2
b135307685603f93,newBusiness Analyst I,Centene Corporation,"Hybrid remote in Rancho Cordova, CA+1 location",,3.2
cd0b637a00f6c73e,newBusiness Analyst,Abbott Laboratories,"Temecula, CA",Estimated $63.5K – $80.5K a year,4.0
1bf3c692579ddc06,newCurriculum and Records Business Analyst - Administrative Ana...,California State University,"San Francisco Bay Area, CA","$6,591 a month",4.3
4127ccbc2b3d4eb2,newInventory Analyst,Get The Very Best Staffing,"Vernon, CA","$65,000 - $85,000 a year",
7661db95c2dbb0d3,newEnvironmental Data Analyst,"A-Tech Consulting, Inc.","Orange, CA",$20 - $24 an hour,
db32254493fab7a4,newData Analyst - Workplace Experience,Electronic Arts,"Los Angeles, CA",,3.8
7dd3d5d32f772e59,newData Analyst II,N Consulting Engineers,"Irvine, CA 92614 92614 (San Joaquin Marsh area)",Estimated $69K – $87.4K a year,
66ebc5c27044b66a,newData Analyst - Pathology Research,City of Hope,"Duarte, CA 91010 91010",,3.7
9370d11297e06f27,newQuality Assurance Analyst,Abbvie,"Irvine, CA",,4.0
2500e5711975151d,newFinancial Analysts II,University of California - Irvine,"Irvine, CA",,4.3
22c98642785f6844,newData Integration Analyst,NeoGenomics Laboratories,"San Diego, CA 92121 92121+1 location",,3.4
7f6aacc3e0c0b1c5,newContent Marketing Analyst,Angi,"Remote in San Diego, CA+2 locations","$50,000 - $70,000 a year",3.3
c9bb68aa1b022660,newSr. Data Analyst,Enjoy Technology,"Remote in Palo Alto, CA 94304 94304",,2.5
0044911b6206fc4e,newOperations Analyst,Installed Building Products,"Visalia, CA 93291 93291+1 location",,3.5
f7c729280825d6d6,newData Visualization Designer,"Rincon Consultants, Inc","Santa Barbara, CA+5 locations",Estimated $72.4K – $91.6K a year,
f38ad02c5b3bf34f,newInfo Governance & Privacy - Data Analytics Experienced Assoc...,PRICE WATERHOUSE COOPERS,"Remote in San Jose, CA 95110 95110",Estimated $71.8K – $91K a year,3.7
831607feb2178590,newVision PEx Data and Analytics Lead (1 of 2),Johnson & Johnson Family of Companies,"Santa Ana, CA",Estimated $119K – $151K a year,
05d3f1c7c202eef6,newSenior Business Analyst,Maersk,"Los Angeles, CA",,4.1
31fb347596516019,newHealth Emergency Preparedness Community Program Analyst II (...,County of San Mateo,"San Mateo, CA","$7,219 - $9,020 a month",
d20a92a57422c4c3,newReport Development Analyst,San Diego Metropolitan Transit System,"San Diego, CA 92101 92101",Estimated $73.7K – $93.3K a year,3.5
ff44dbb8c882d44d,newBusiness Analyst,FriendFinder Networks,"Temporarily Remote in San Jose, CA 95128 95128","$85,000 - $105,000 a year",2.8
16b2ce48c865f2bd,newBusiness Analyst for a growing Global Beauty/Cosmetics CPG C...,"Vertical Careers, Inc.","Walnut, CA 91788 91788","$125,000 a year",
c8ddcf038039cc40,newDevelopment Associate- Data Analyst,Fresnos Chaffee Zoo Corp,"Fresno, CA 93728 93728 (West area)",$18.66 an hour,
6251fdc0e9677247,newTechnical Data Analyst & SQL Expert,DT Professional Services,"Remote in Los Angeles, CA 90001 90001",Estimated $89.7K – $114K a year,
7ec824b5e883aa59,newBusiness Analyst,Sedna Consulting Group,"Hybrid remote in Sacramento, CA 95822 95822",$60 - $65 an hour,
411ba4c37dc5416f,newSenior Data Analyst,Walmart,"Sunnyvale, CA 94086 94086 (West Murphy area)+1 location",,3.5
8c39f63062225ebc,newEnterprise BI Analyst,Howmet Aerospace,"Torrance, CA 90505 90505",,3.2
46b7039018ae0ecb,"newProduct Analyst, Buyer and Seller Standards",Visa,"Foster City, CA",,3.9
2e78203970a690e4,newStaff Business Data Analysis,Intuit,"Mountain View, CA 94043 94043+1 location",,4.2
fd5b83299c9f0dfa,newBusiness Analyst (Hybris) - HYBBA,"Evergreen Technologies, LLC.","Remote in Los Angeles, CA+9 locations",Estimated $101K – $128K a year,
f38ad02c5b3bf34f,newHealthcare Data Analyst I - Pharmacy,Inland Empire Health Plans,"Rancho Cucamonga, CA 91730 91730+2 locations","$79,810 - $101,774 a year",3.6
ec1ade605dd2220c,newBusiness Analyst,Deloitte,"San Jose, CA 95113 95113 (Downtown area)+18 locations",,4.0
b4c58df0dd35fe00,newBusiness Analyst,SAS Retail Services,"Remote in Orange, CA 92867 92867",,2.9
3d84c38e260a087b,"newSenior Manager, Business Intelligence",Seesaw,"Remote in San Francisco, CA 94102 94102",Estimated $125K – $158K a year,
16b2ce48c865f2bd,newSALESFORCE BUSINESS ANALYST,STAND 8,"Universal City, CA+1 location",Estimated $128K – $162K a year,
5791c1c22e961482,newServiceNow Business Analyst - HRSD,"Amick Brown, LLC","Sunnyvale, CA",Estimated $80.5K – $102K a year,5.0
e1da8476d5f6d19a,newCurriculum and Records Business Analyst - Administrative Ana...,California State University,"San Francisco Bay Area, CA","$6,591 a month",4.3
37f37138a7ff1526,newReport Development Analyst,San Diego Metropolitan Transit System,"San Diego, CA 92101 92101",Estimated $73.7K – $93.3K a year,3.5
e551922392e27af9,newVision PEx Data and Analytics Lead (1 of 2),Johnson & Johnson Family of Companies,"Santa Ana, CA",Estimated $119K – $151K a year,
efb31e7eddb336d2,newSenior Business Analyst,Samsara,"San Francisco, CA 94107 94107 (Potrero Hill area)",Estimated $101K – $129K a year,4.3
8c39f63062225ebc,newTechnical Business Analyst,CoStar Group,"Irvine, CA 92612 92612",Estimated $90.7K – $115K a year,2.9
22c98642785f6844,newBusiness Analyst (Testing),"CGI Group, Inc.","Sacramento, CA 95828 95828",,3.6
d03a6026f0a10b7c,newFinancial Planning Analyst,Ameriprise Financial,"Woodland Hills, CA",,3.8
27cef5ae91ef8b8f,newBusiness Analyst for a growing Global Beauty/Cosmetics CPG C...,"Vertical Careers, Inc.","Walnut, CA 91788 91788","$125,000 a year",
17fd6390cdfdb674,newBusiness Intelligence Manager,"Senior Resource Group, LLC","Solana Beach, CA 92075 92075",,
ec1ade605dd2220c,newBusiness Analyst,Bridge Home Health and Hospice,"San Diego, CA 92122 92122 (University City area)",,3.7
06d065058d45f2d2,newBusiness Analyst,Deloitte,"San Jose, CA 95113 95113 (Downtown area)+18 locations",,4.0
a7a8820a37d6f251,newSr. Business Analyst,"Harbor Freight Tools USA, Inc.","Calabasas, CA 91302 91302",,3.3
260fa1903f63cafa,newAdministrative Analyst I/II,CalHR,"Bishop, CA",,5.0
3d84c38e260a087b,"newSenior Manager, Business Intelligence",Seesaw,"Remote in San Francisco, CA 94102 94102",,
a3f7584644d69e49,newSr. Internal Audit Associate - Data Analytics (Remote Oppty),Silicon Valley Bank,"Remote in Santa Clara, CA 95054 95054",,3.8
e0048a0b2cb3e8c4,newBusiness Intelligence Manager,"Senior Resource Group, LLC","Solana Beach, CA 92075 92075",,
6f5804dce79ebd85,"newSenior Analyst, GTM Analytics",Tipalti,"San Mateo, CA",,
e9455eb320154185,newSALESFORCE BUSINESS ANALYST,STAND 8,"Universal City, CA+1 location",,
e551922392e27af9,newSenior Human Resources Analyst,City of Elk Grove,"Elk Grove, CA 95758 95758",,4.2
cef43bd8b72f8250,newBA Director - Salesforce Solutions,Paramount,"Los Angeles, CA 90038 90038",,3.5
efb31e7eddb336d2,newPwC Technology - Business Analyst,PRICE WATERHOUSE COOPERS,"San Francisco, CA 94111 94111 (Financial District/South Beach area)+6 locations",,3.7
ef896ee3ff869d4e,newFinancial Data Analyst,Lyft,"Hybrid remote in San Francisco, CA 94110 94110","$106,260 - $126,500 a year",3.5
e87b2088278c1867,newInternal Audit Manager - Data Analytics (Remote Oppty),Silicon Valley Bank,"Remote in Santa Clara, CA 95054 95054",,3.8
b6b45f77a91bc941,new1053-IS Business Analyst-Senior,City and County of San Francisco,"San Francisco, CA 94103 94103 (Mission area)",,4.0
3691a35d597a41ab,newSenior Lead Analytics Consultant,WELLS FARGO BANK,"Concord, CA+4 locations",,
06d065058d45f2d2,newTechnical Business Analyst,CoStar Group,"Irvine, CA 92612 92612",Estimated $90.7K – $115K a year,2.9
268f315ab4e87edd,newAdministrative Analyst I/II,CalHR,"Bishop, CA",Estimated $51.4K – $65K a year,5.0
260fa1903f63cafa,newBA Director - Salesforce Solutions,Paramount,"Los Angeles, CA 90038 90038",,3.5
53a252df051bc20c,newFinancial Data Analyst,Lyft,"Hybrid remote in San Francisco, CA 94110 94110","$106,260 - $126,500 a year",3.5
3ddc64781c089f29,"newSenior Sales Strategy Manager (Senior Manager I, Business An...",Walmart,"San Bruno, CA",,3.5
e1da8476d5f6d19a,newSenior Human Resources Analyst,City of Elk Grove,"Elk Grove, CA 95758 95758",Estimated $86K – $109K a year,4.2
e0048a0b2cb3e8c4,newEntry Level Data Analyst,Talentheed Inc,"San Jose, CA","$70,000 - $80,000 a year",4.6
e9455eb320154185,"newAnalyst, Data Operations","Sony Pictures Entertainment, Inc.","Culver City, CA",Estimated $61.7K – $78.1K a year,4.1
1289e3c6101ca696,"newAnalyst, Data (REMOTE)",Molina Healthcare,"Remote in Long Beach, CA 90802 90802+2 locations",,3.3
adf17c02f4059bc0,newBusiness and Data Analyst,LG Ads Solutions,"Mountain View, CA",Estimated $77.8K – $98.4K a year,
c458dcf79a7a7f7e,newSr Business Data Analyst,ServiceNow,"Remote in San Diego, CA 92121 92121",,3.6
934f839fc694106d,newData Governance Analyst (remote),Solidigm,"Remote in San Jose, CA",Estimated $85.9K – $109K a year,
6ce4148bd0aaae21,"newData Analyst, Finished Vehicle Logistics",Tesla,"Fremont, CA",,3.4
94af97c585332b61,newData Analyst,Össur,"Foothill Ranch, CA",Estimated $82.6K – $105K a year,3.8
17ecfde80aa036f0,newAdministrative Analyst/Specialist,California State University,"Pomona, CA+2 locations","$3,288 - $6,347 a month",4.3
72fbc0653a74ef39,"newAssociate, Data Analyst & Client Experience",Team Rubicon,"Remote in Los Angeles, CA 90045 90045",,4.6
9fd77d32d86dc0b9,newJr. Data Analyst,Axos Bank,"San Diego, CA 92122 92122 (University City area)",,3.0
b3b664c774b8b808,newData Analyst,Cognizant Technology Solutions,"Sunnyvale, CA",,3.9
30d53e1d1e8a5150,newData Analyst,Cognizant,"Sunnyvale, CA",,
8422020007aadafc,newBusiness and Data Analyst,LG Ads Solutions,"Mountain View, CA",,
1289e3c6101ca696,newLead Data Analyst,Disney Media & Entertainment Distribution,"Santa Monica, CA+1 location",,
2c3192541e64eb17,newSenior Data Analyst,DISH,"Foster City, CA 94404 94404 (Town Center area)","$86,940 a year",3.2
5d65aa7170a99f61,"newCompliance Data Analyst, Trust and Safety",Google,"Sunnyvale, CA (Lakewood area)",,4.3
283efbae4b6885ca,newHealthcare Data Analyst,USAble Life,United States,,3.4
836ec28b156acd44,newApplications Analyst,BOEING,"Seal Beach, CA",,3.9
69039ce1d1dcd089,newBusiness Intelligence Analyst,ATTOM Data Solutions,"Remote in Irvine, CA","$90,000 - $100,000 a year",
5476110d05185e7a,newPersonnel Analyst III,San Joaquin County,"Stockton, CA 95207 95207 (Tam O'Shanter area)","$7,343 - $8,925 a month",3.6
dd974b7e15e74bcf,newBusiness Intelligence Construction - Data Analyst,Turner & Townsend,"San Francisco, CA+1 location",,3.6
210fb4a635fecdc2,newData Analyst,Logisticom,"Los Angeles, CA",$17 - $22 an hour,
81ce0d1b1ee92f2a,newDigital Customer Success Data Analyst - Slack,Salesforce,"San Francisco, CA 94105 94105 (Financial District/South Beach area)",,4.3
268f315ab4e87edd,newSupply Chain Assistant Data Analyst,Neotech,"Chatsworth, CA 91311 91311",,3.5
28eb1ac521ad3fd9,newDirector of Quality and Data Analytics,Family Health Centers of San Diego,"San Diego, CA 92102 92102 (Mt. Hope area)",,3.4
cf07b88b60cdf14e,newSenior Development Analyst,City of Santa Monica,"Santa Monica, CA","$98,316 - $121,380 a year",3.8
1dd98f69e55c43b1,newProject Policy Analyst III,University of California - Irvine,"Irvine, CA",,4.3
3d8c18130f79bbd2,newBusiness Analyst,Daymon,"Remote in Orange, CA 92867 92867",,
76ab1939b0c6c691,newCompensation Analyst,Fender,"Remote in Los Angeles, CA",,2.8
816dd492deb587a3,newGrievance & Appeals Analyst,Community Health Group,"Chula Vista, CA 91914 91914 (Fenton St area)",,3.7
7b19fdca0189f566,newCompensation Analyst,City of Hope,"Irwindale, CA",,3.7
2cc9764d097595f4,newSr Business Data Analyst,ServiceNow,"Remote in San Diego, CA 92121 92121",,3.6
4058af580279e1e2,newSenior Transportation Data Analyst,Energetics Careers,"Remote in San Diego, CA+1 location",,3.6
e6d534251395a9a5,newData Governance Analyst (remote),Solidigm,"Remote in San Jose, CA",,
